,title,artist,lyrics
34,꼬마 (GGOMA) (Feat. 최예근),태호 (TAE HO),꿈 많던 꼬꼬마의 용기는 대단했었지뭐든 다 잘할 수 있을 것만같아 보였어이것저것 다 해낼 거라나 뭐라나그저 순수해서그랬겠지 그때까지는점점 자라나는 내 키만큼 커져만 가는고민들은 나를 자꾸 흔들어 놓지 모야이럴 순 없어 말도 안 돼잘할 거야 너니까또 꿈꾸자 뛰어보자hey I'm never gonna give up그래 덤덤 덤덤덤 덤위로 둥둥 둥둥둥 둥넌 잘할 수 있으니까 부디 걱정하지 마그래 넌넌 넌넌넌 넌You're gonna make itbaby You're gonna make it한 소녀도 아주어렸을 적에 꿈이 있었지많은 사람들은쉽지 않을 거라고 말했어누가 뭐래도 난 절대 의심치 않았지아무 걱정 없이 잘할 거라 믿었으니까점점 자라나는 내 꿈만큼 커져만 가는고민들은 나를 자꾸 흔들어 놓지 모야그럴 수 있어 다시 한번잘할 거야 너니까더 꿈꾸자 뛰어보자Everything’s gonna be alright그래 덤덤 덤덤덤 덤위로 둥둥 둥둥둥 둥넌 잘할 수 있으니까부디 걱정하지 마그래 넌넌 넌넌넌 넌You're gonna make it짙은 어둠의 끝에서눈부시게 빛나는바라고 바라던 순간이나에게 다가와그래 덤덤 덤덤덤 덤위로 둥둥 둥둥둥 둥넌 잘할 수 있으니까부디 걱정하지 마그래 넌넌 넌넌넌 넌You're gonna make itbaby You're gonna make it
35,Telephone,TeRish (테리쉬),그에게서 나는 멀어진걸까뜸해져버린 우리 혼자걷는 거리그에게서 나는 멀어진듯해내 오해이길 바래Pray it's my own faultYou're theOnlyCall that i will wait forAll dayAll nightI will stand by the phoneSome waySome howKeep you in my heart please sayYou're my only love soOh my babyYou’re my sunshine나 만의 그대여내옆에 있어줘요내곁에 머물러요언제쯤 나 너를 알수있을까하루는 상냥하고 하루는 서운하네언제나 넌 나를 기다리게해내 오해이길 바래Pray it's my own faultYou're theOnlyCall that i will wait forAll dayAll nightI will stand by the phoneSome waySome howKeep you in my heart please sayYou're my only love soOh my babyYou’re my sunshine나 만의 그대여내옆에 있어줘요내곁에 머물러요I will have your loveCan this be our love song우 전화가 오길기다리잖아You're my only love soOh my babyYou’re my sunshine나 만의 그대여내옆에 있어줘요내곁에 머물러요I will have your loveCan this be our love song
36,좋아한다 그래,Cookie,너와 내가 처음 만났었을 때부끄러워 아무 말도 못 하고무슨 말을 먼저 해야 되는지생각조차 나지 않아어색했던 너의 말투와 행동조심스레 짓던 너의 미소가머릿속에서 떠나지가 않아이미 빠졌나 봐어쩔줄를 몰라 자꾸 기다려너의 전화를언제 또 너를 볼까 뭐라 말할까너도 지금 생각할까좋아한다 말해 사랑한다 그래아직까지 말을 왜 못해함께 한다면 beautiful day언제라도 같이 라면 Shiny Day좋아한다 말해 사랑한다 그래아직까지 말을 왜 못해우리같이 얘기하고둘이 같이 걸을 수 만 있다면그렇게만 할 수 있다면 좋을 텐데어색했던 너의 말투와 행동조심스레 짓던 너의 미소가머릿속에서 떠나지가 않아이미 빠졌나 봐어쩔줄를 몰라 자꾸 기다려너의 전화를언제 또 너를 볼까 뭐라 말할까너도 지금 생각할까좋아한다 말해 사랑한다 그래아직까지 말을 왜 못해함께 한다면 beautiful day언제라도 같이 라면 Shiny Da좋아한다 말해 사랑한다 그래아직까지 말을 왜 못해우리같이 얘기하고둘이 같이 걸을 수만 있다면그렇게만 할 수 있다면 좋을 텐데나 너 좋아하나 봐나 너 사랑하나 봐답답하게 왜 당당하게너 말을 못 해 기다리잖아우리 사이 가까워지기시간 문제잖아tell me love you baby좋아한다 말해 사랑한다 그래지금까지 말을 왜 못해함께 한다면 beautiful day언제라도 같이 라면 Shiny Day좋아한다 말해 사랑한다 그래아직까지 말을 왜 못해우리같이 얘기하고둘이 같이 걸을 수만 있다면그렇게만 할 수 있다면 좋을 텐데
37,돈이뭐야 밥이뭐야,밥펄라,우리가 살아가는 세상앞만보고 달려가야 했지시간은 흘러흘러 꿈과 같은 지금시간이 돈인줄 알면서 흘러 보냈지돈없는 세상 믿었지만돈이뭐야 돈이뭐야돈맛으로 허무한 세상밥이뭐야 밥이뭐야밥맛으로 정드는 세상돈없이 살아가는 세상하늘에서 밥꽃 피어 났지내마음 하얀구름 밥꽃 피워 놓고따스한 하얀밥 갖지어 먹고 싶었지돈없는 세상 믿었지만돈이뭐야 돈이뭐야돈맛으로 허무한 세상밥이뭐야 밥이뭐야밥맛으로 정드는 세상돈이뭐야 밥이뭐야정신없이 흐르는 시간하루하루 정 때문에살아가는 밥있는 세상
38,Healthy Food,민수,Tofu carrots in my mindApple cabbage morning juiceAvocado with pepperPizza sometimes but zero cokeNot too manySugar freeNot too saltyGluten freeNot too manySugar freeNot too saltyGluten freeNot too manyDairy freeNot too saltyGluten freeNot too manyDairy freeNot too saltyGluten freeHealthy food every dayHealthy food every dayAcai bowl with coconutLow fat milkBoil myBroccoli with eggChicken breastNot too manySugar freeNot too saltyGluten freeNot too manySugar freeNot too saltyGluten freeNot too manyDairy freeNot too saltyGluten freeNot too manyDairy freeNot too saltyGluten freeCheck my body right nowmy body lineHealthy food with meStanding mirror timeCheck my body right nowmy body lineHealthy food with meStanding mirror timeHealthy food every dayHealthy food every dayHealthy food with meStanding mirror time
39,Like It Hot,공원소녀 (Girls in the Park),Like It HotLike It Hot저마다 간절한 꿈그 빛이 화려한 곳절대로 지지 않는 저 뒤에 널 알아작지만 강렬한 춤턱 끝에 차오른 숨우린 어쩌면 같은 꿈을 꿨지닿고 싶은 걸너의 마음 속에차고 차오르는 너에게로more more들어주고 싶은 너야말해봐 yeah tell me more희미한 어젤 견딘 지금 너의 찬란함숨겨야만 했던 너의 story를 알려줘Tell me 쉿 비밀로 할게Show me 숨겨진 이야기baby 다 보여줘 nowlike it hot like it hotYes me 긴 밤의 moonlight저 달빛 널 바라본 eyesJust tell me 다 보여줘 봐like it hot like it hotla la la like it hot ohla la la like it hot Yeahla la la like it hotyou know me you know meyeah baby언젠가 나에게 말한 것 처럼달은 욕심이 많아 like black hole그 많고 많은 속삭임소원들을 채우기만 하잖아아니 나는 알아좀 서툰 것뿐이야조용하게 날 지켜주잖아작은 비밀을 모두 간직한 채닫지 말아줘너를 찾아 갈게차고 차오르는 너에게로more more들려주고 싶은 너야들어봐 listen to me more차가운 어젤 견딘 지금 너의 찬란함감춰야만 했던 너의 secret 알려줘Tell me 쉿 비밀로할게Show me 숨겨진 이야기baby 다 보여줘 nowlike it hot like it hotYes me 긴 밤의 moonlight저 달빛 널 바라본 eyesJust tell me 다 보여줘 봐like it hot like it hotla la la like it hot ohla la la like it hot Yeahla la la like it hotyou know me you know me익숙해져버린 어둠but it’s okay네가 서있기에 with me살짝 이지러진 채어둠 속 밝혀주던 너그 시간을 다 알아oh 그 하루하루의 너를너의 겉에 새겨진까맣게 물 들여진네 안에 상처를 어루만져 주고 싶어 난Tell me 쉿 비밀로할게Show me 숨겨진 이야기baby 다 보여줘 nowlike it hot like it hotYes me 긴 밤의 moonlight저 달빛 널 바라본 eyesJust tell me 다 보여줘 봐like it hot like it hotla la la like it hotla la la like it hotla la la like it hotyou know me you know mela la la like it hot like it hotla la la like it hot babyla la la like it hot like it hotla la la like it hot
40,FIRST,EVERGLOW (에버글로우),EVERGLOW어두운 밤을 두려워했지Ah yeah yeah너도 몰래 숨어버렸지Ah yeah yeahNo one say happy ending숨죽이고 도망 다니지Here we go Here we go likeKnock Knock There’s a monster점점 커져 네 안의 black holeWhen you back uh너를 삼킨 howler 그게 바로 killer겁내지 마 손을 잡아봐지나간 과거 너를 두렵게 해but know your power최후의 be firstYou know that I come firstI’m the winner winner winner그래 마지막 선율너를 구할 구할 구할So Don’t Keep이 세상 어디도 빛은 없단 거짓에속지는 말아줘 우리 함께본 적 없는 꿈을 꿀 거야나나나나나나본 적 없는 꿈을 꿀 거야Ya 넘어져도 돼 stand up그건 바로 너 hands upFaster Stronger BetterGotta be the best밤과 아침 경계 그 사이대충 새벽 다섯 시 반총성 없는 전쟁은숨을 조여와 이건 FOUL거짓 어둠 진실 환희 판타지내 촛불이 널새벽의 멜로디 불꽃처럼 터져겁내지 마 손을 잡아봐지나간 과거 너를 두렵게 해but know your power최후의 be firstYou know that I come firstI’m the winner winner winner그래 마지막 선율너를 구할 구할 구할So Don’t Keep이 세상 어디도 빛은 없단 거짓에속지는 말아줘 우리 함께본 적 없는 꿈을 꿀 거야막힌 벽을 부숴 난 선을 넘어움츠리지 않아 난 뛰어넘어one stepYou got me now got me nowtwo stepDon’t slow it down slow it down너를 찾아오는 하늘을 향해 shout희망이란 열쇠를 잡아EYYou know that I come firstI’m the winner winner winner그래 마지막 선율너를 구할 구할 구할So Don’t Keep이 세상 어디도 빛은 없단 거짓에속지는 말아줘 우리 함께보여줄게 본 적 없는 First들려줄게 본 적 없는 First알려줄게 본 적 없는 First
41,파도,폴킴,눈이 부시게아름답던 바다나의 눈 속엔그보다 더 고운 너였어하얀 모래 위너와 내가 남긴 추억들파도가 떠나도내겐 지워지지 않는 걸너를 보내고나 또다시 찾은 바닷가하지만 이제 내 곁에다른 사람 있는 걸새롭게 시작하고 싶어그녀를 따라왔어하지만 내 맘네 모습만 생각이 나그녀 머리에쏟아진 별빛들그 별빛 아래약속한 지난날이 떠올라흔들리는 나의 마음을가눌 길 없는 내 눈빛너와 비슷한 사람마저 쫓고 있었어그 순간 내 두 눈 속에너무 익숙했던 너의 뒷모습그렇게 그리던 지난날바로 너였어눈이 부시게아름다운 바닷가나의 눈 속엔그보다 고운 너였어하얀 내 맘에지난날 우리가 남긴 추억들파도가 안기듯다시 내게 돌아오는 걸나와 마주친 당황한 네 얼굴하지만 너의 곁에도다른 누가 있는 걸너를 안고 싶은 내 가슴널 붙잡고픈 내 손길허나 넌 이미 나를 둔 채 멀어져 갔어하지만 널 돌아본 순간두 눈에 흐르던 네 눈물 때문에꼭 나처럼 기다린너란 걸 알았어 날 봐다시 너에게 달려가는 나를 봐찌는 태양도내 사랑을 가릴 순 없어하얀 모래 위우리의 사랑을 다시 새겨봐이제는 내 사랑너를 놓지 않을 테니까
42,GEMINI,AB6IX (에이비식스),머리가 아파 잠에서 깼을 때왠지 불안한 맘에 널 불러 보지만아무도 없는 공허한 방안을낯선 메아리처럼 감싸고 있어아직 꿈속을 떠다니고 있는 걸까시계가 아닌 내가 이상해진 걸까어색하기만 해 지금 모든 게저 멀리 aurora 지친 날 부르는데고장 난 나침반처럼 헤매이는데이젠 갈 곳을 잃은 채어디선가 날 부르는 목소리I’m your geminiYou’re my mercury운명처럼 서롤 찾는 숨소리I’m your geminiYou’re my mercury까마득한 어둠을 헤치고나온 뒤 주위를 둘러보니아무도 없는 공간에 나 혼자동시에 날 찾아 오는 건 공허함과 불안함지금 내 귀에 들리는 건 떨림 섞인 나의 숨나는 믿어 너도 날 찾는다고운명처럼 우린 다시 만날 거라고떨어진 나침반을 주워 하늘 위로 던져바람이 날 이끄는 곳 그곳엔 네가 있길차가운 침묵 속을 채운 외로움도날 잠식하는 이유 모를 그리움도내겐 무겁게만 느껴지는걸운명이 있다면 널 내게 데려올까기적처럼 우연히 너를 마주칠까너무 늦진 않은 걸까어디선가 날 부르는 목소리I’m your geminiYou’re my mercury운명처럼 서롤 찾는 숨소리I’m your geminiYou’re my mercuryWoooI’m so lonely Baby I keep fallin'WoooI’m so lonely Baby I keep fallin'익숙하지 않은 차가웠던 꿈도손댈 틈도 없이 망가진 이 시간도너만 있으면 견딜 수 있을 텐데대체 난 어디에 서 있는지 where you at귓가를 스치는 너의 목소리I’m your geminiYou’re my mercury너에게 달려가는 내 숨소리I’m your geminiYou’re my mercuryWoooI’m on my way Baby I'm on my wayWoooI’m on my way Baby I'm on my way
43,FIND YOU,LULUPOP (룰루팝),오늘도 내 다이어리엔똑같은 일상을 그려Oh 자그마한 유리잔에비춰진 내 모습이 보여 모습이 보여어디선가 나를 끌어당기고 있는지틈 사이로 보이는 저 빛을 따라가는 길알 수 없는 나의 생각을 잠시 멈춘 뒤오랫동안 기다렸던 나만의 공간Maybe I can find youMaybe I can find youMaybe I can find you right nowMaybe I can find you right nowGonna find you right nowWoo 아무도 모르는 기억 안에그곳으로 나는 이끌려거울 같은 문 앞에 서면나도 모르게 열고 싶어져무언가가 나를 끌어당기고 있는지틈 사이로 보이는저 빛을 따라가는 길나를 바라보는 너에겐 어떤 비밀이낯설지만 끌리는You make me feel so highMaybe I can find youMaybe I can find youMaybe I can find you right nowMaybe I can find you right nowGonna find you right nowTell me what it is right now고요함 속의 날갯짓 소리와끝없이 펼쳐진 무한한 공간마치 영원할 것 같아수많은 불빛과내 곁을 맴도는 이 moonlight지금 이 순간 속 내가 서 있는 곳내가 꿈꿔왔던 dreamlike spaceMaybe I can find youMaybe I can find youMaybe I can find you right nowMaybe I can find you right nowGonna find you right nowMaybe I can find youMaybe I can find youMaybe I can find you right nowMaybe I can find you right nowGonna find you right now
44,Far away,더 데이지 (The Daisy),Far away 여기에 두고서 잊어요지쳤던 그날들더는 없을 것만 같은 우리 Far away미안해 내가 다 미안해할 말이 없어요이대로 돌아가요Leave me alone시간이 흘러도 난 해줄 게 없어 나는멈춰요 그만해요웃을 수가 없잖아한숨만 나오는 걸지쳐가 힘든 날들마음은 그렇지 않아근데 그댈 아프게만 해못난 나라서 그런가봐Far away 여기에 두고서 잊어요지쳤던 그날들더는 없을 것만 같은 우리 Far away미안해 내가 다 미안해할 말이 없어요이대로 돌아가요Leave me alone시간이 흘러도 난 해줄 게 없어 나는멈춰요 그만해요웃을 수가 없잖아한숨만 나오는 걸지쳐가 힘들 날들마음은 그렇지 않아근데 그댈 아프게만 해못난 나라서 그런가봐Far away 여기에 두고서 잊어요지쳤던 그날들더는 없을 것만 같은 우리 Far away지나간 기억들이 나를 스쳐지나가아프고 아프면 다 잊을까 정말Far away 여기에 두고서 잊어요지쳤던 그날들더는 없을 것만 같은 우리 Far away미안해 내가 다 미안해할 말이 없어요이대로 돌아가요 Leave me alone
